{
  "$schema": "https://json-schema.org/draft/2020-12/schema",
  "$id": "https://ontogony.local/schemas/system-protocol-registry.schema.json",
  "title": "Ontogony System Protocol Registry",
  "type": "object",
  "required": [
    "schema",
    "baseline",
    "generatedAt",
    "runtimeLock",
    "repos",
    "protocols",
    "evidence",
    "quarantines"
  ],
  "properties": {
    "schema": {
      "const": "ontogony-system-protocol-registry-v1"
    },
    "baseline": {
      "type": "string",
      "pattern": "^SYSTEM-(ALPHA-[0-9]{3}|RC-001[A-Z])$"
    },
    "generatedAt": {
      "type": "string"
    },
    "runtimeLock": {
      "type": "object",
      "required": ["ownerRepo", "path"],
      "properties": {
        "ownerRepo": { "type": "string" },
        "path": { "type": "string" }
      }
    },
    "apiPrefixes": {
      "type": "object",
      "additionalProperties": { "type": "string" }
    },
    "repos": {
      "type": "array",
      "minItems": 1,
      "items": {
        "type": "object",
        "required": ["name", "role", "ref", "commit"],
        "properties": {
          "name": { "type": "string" },
          "role": { "type": "string" },
          "ref": { "type": "string" },
          "commit": {
            "type": "string",
            "pattern": "^[0-9a-f]{40}$"
          },
          "packageVersions": {
            "type": "array",
            "items": { "type": "string" }
          }
        }
      }
    },
    "protocols": {
      "type": "array",
      "minItems": 1,
      "items": {
        "type": "object",
        "required": ["id", "ownerRepo", "kind", "paths"],
        "properties": {
          "id": { "type": "string" },
          "ownerRepo": { "type": "string" },
          "protocolId": { "type": "string" },
          "authorityMode": {
            "enum": [
              "authoritative",
              "draft_only",
              "simulation_only",
              "blocked",
              "local_only",
              "observational",
              "gateway",
              "unknown"
            ]
          },
          "sideEffectLevel": {
            "enum": [
              "none",
              "read_only",
              "evidence_record",
              "semantic_decision",
              "run_state_transition",
              "model_call",
              "local_sandbox_effect",
              "real_external_blocked",
              "unknown"
            ]
          },
          "kind": {
            "enum": [
              "route",
              "auth",
              "env",
              "error",
              "trace",
              "evidence",
              "frontend-route",
              "runtime-lock",
              "observability"
            ]
          },
          "paths": {
            "type": "array",
            "minItems": 1,
            "items": { "type": "string" }
          },
          "validators": {
            "type": "array",
            "items": { "type": "string" }
          },
          "notes": { "type": "string" }
        }
      }
    },
    "evidence": {
      "type": "array",
      "items": {
        "type": "object",
        "required": ["id", "ownerRepo", "path", "verdict"],
        "properties": {
          "id": { "type": "string" },
          "ownerRepo": { "type": "string" },
          "path": { "type": "string" },
          "verdict": { "type": "string" },
          "recordedAt": { "type": "string" }
        }
      }
    },
    "quarantines": {
      "type": "array",
      "items": {
        "type": "object",
        "required": ["id", "status", "rationale"],
        "properties": {
          "id": { "type": "string" },
          "status": {
            "enum": ["open", "cleared", "carried-forward"]
          },
          "rationale": { "type": "string" },
          "followup": { "type": "string" }
        }
      }
    }
  }
}
